MovementID,ItemID,SupplierID,MovementType,Quantity,MovementDate,Remarks
M0001,82,S004,Outgoing,29,2024-02-12 07:26:37,Truth career hundred late fund among.
M0002,1,S001,Incoming,29,2024-10-14 19:03:40,Hotel open sometimes bar.
M0003,37,S009,Outgoing,44,2024-01-14 21:13:00,Others possible marriage.
M0004,36,S014,Incoming,79,2024-07-11 23:59:33,Physical decade color attorney.
M0005,40,S003,Outgoing,,2024-06-14 05:27:00,Woman plant same boy treatment.
M0006,48,S013,Incoming,62,2024-02-25 00:29:49,Though upon in clearly computer challenge.
M0007,49,S004,Incoming,44,2024-01-25 14:37:34,Public peace set.
M0008,53,S013,Incoming,13,2024-10-19 20:46:52,Choice example face seek use hard.
M0009,87,S006,Outgoing,55,2024-06-10 02:49:05,Dinner just use particularly popular.
M0010,90,S005,Incoming,27,2024-09-03 17:11:05,Make box realize.
M0011,82,S007,Outgoing,54,2024-04-04 09:56:04,Expect include station occur husband.
M0012,78,S013,Incoming,1,2024-11-15 06:56:11,Treatment themselves opportunity.
M0013,19,S015,Outgoing,29,2024-07-02 21:51:49,Not hotel apply president contain.
M0014,8,S013,Outgoing,31,2024-05-05 09:56:01,Effort daughter as occur parent left.
M0015,29,S005,Incoming,42,2024-05-07 12:58:26,Fine pick political once benefit require.
M0016,22,S009,,61,2024-05-12 13:19:36,Write probably according with report.
M0017,12,S015,Outgoing,70,2024-02-27 00:02:26,Health after sign front.
M0018,29,S014,Outgoing,77,2024-09-02 20:33:17,Hour daughter style hotel yes likely.
M0019,14,S001,Outgoing,71,2024-02-09 12:26:44,Evening clearly under.
M0020,71,S020,Outgoing,24,2024-07-14 03:47:31,Member really marriage hospital wife.
M0021,70,S014,Outgoing,47,2024-03-23 20:03:09,Imagine behind million rate enjoy message.
M0022,34,S013,Outgoing,36,2024-01-21 20:59:22,Style according water.
M0023,39,S015,Incoming,66,2024-08-13 04:41:40,Door recently whom.
M0024,58,S019,Incoming,11,2024-03-28 11:22:59,Manage respond should these grow.
M0025,96,S012,Outgoing,9,2024-01-13 11:42:29,Assume exactly east learn some.
M0026,86,S011,Incoming,53,2024-01-20 10:19:04,Size reveal summer similar.
M0027,73,S013,Outgoing,78,2024-08-11 19:05:50,Responsibility rest strong.
M0028,13,S002,Incoming,56,2024-06-16 13:35:01,Coach wall here about last conference.
M0029,24,S012,Incoming,72,2024-02-09 01:00:24,Trip such religious person.
M0030,45,S017,Incoming,81,2024-10-20 03:30:39,Huge tonight bad attorney bed.
M0031,100,S001,Outgoing,76,2024-07-04 14:24:22,Well economy tree.
M0032,74,S010,Outgoing,54,2024-09-24 17:28:04,Radio through development financial benefit physical.
M0033,16,S014,Outgoing,17,2024-08-28 15:23:42,Short already remain shoulder late.
M0034,3,S002,Outgoing,87,2024-04-15 22:30:58,Process put area human.
M0035,85,S012,Outgoing,74,2024-10-16 23:19:26,Kid government value.
M0036,87,S020,Incoming,68,2024-03-30 23:57:57,Price writer behind lead point.
M0037,100,S001,Incoming,22,2024-09-07 18:36:33,That argue everyone clearly.
M0038,52,S004,Incoming,86,2024-02-17 23:06:26,Cost address indicate new of enough.
M0039,85,S019,Incoming,79,2024-06-19 18:07:19,Base share bar pick.
M0040,89,S016,Incoming,63,2024-11-02 15:41:44,Room source form a kid.
M0041,55,S017,Outgoing,48,2024-09-21 18:47:25,Speak whatever book simple community tree.
M0042,45,S011,Outgoing,71,2024-06-09 19:08:19,Reveal east when leg him.
M0043,14,S002,Incoming,8,2024-06-20 05:26:54,Mention account share.
M0044,18,S006,Outgoing,25,2024-10-24 21:48:10,Friend care window.
M0045,74,S001,Outgoing,27,2024-09-24 16:57:24,Activity member respond guess like.
M0046,92,S010,Incoming,70,2024-11-05 11:01:18,Design mention well candidate.
M0047,99,S009,Incoming,86,2024-07-18 02:30:37,Significant above account air anything spend.
M0048,23,S009,Incoming,78,2024-08-04 01:30:23,Hope ten mother to moment.
M0049,97,S007,Outgoing,32,2024-11-09 10:08:41,Claim rule admit happy quite.
M0050,94,S008,Incoming,95,2024-06-03 23:04:00,Anyone line top almost.
M0051,68,S007,Incoming,22,2024-03-15 20:58:53,Interesting nearly part stage wonder.
M0052,49,S010,Outgoing,86,2024-01-29 08:01:07,Bad nearly listen story performance tree.
M0053,11,S008,Outgoing,7,2024-04-06 00:45:01,Crime range support decide professional.
M0054,31,S016,Outgoing,29,2024-01-20 19:48:28,Week side away school doctor.
M0055,61,S009,Outgoing,,2024-08-28 18:33:30,Lawyer follow expert.
M0056,2,S014,Outgoing,92,2024-05-01 12:47:03,Seek power issue assume.
M0057,93,S006,Outgoing,95,2024-08-09 21:24:59,Order dinner member move.
M0058,68,S016,Outgoing,41,2024-09-24 10:35:02,Though history much material.
M0059,59,S019,Outgoing,56,2024-06-02 23:20:29,Book about nature range operation.
M0060,64,S011,Incoming,71,2024-03-30 14:18:32,Approach value should.
M0061,12,S018,Incoming,17,2024-03-25 20:17:17,Science find several professional their.
M0062,32,S015,Incoming,62,2024-08-27 15:06:15,Interesting it wall interview spend experience.
M0063,18,S012,Incoming,99,2024-06-12 06:04:19,Whose former me represent.
M0064,98,S019,Outgoing,35,2024-01-20 00:00:16,Use different move cause.
M0065,96,S013,Outgoing,61,2024-10-04 00:19:47,Itself feel record.
M0066,45,S017,Outgoing,89,2024-06-03 22:34:16,Worry different statement.
M0067,87,S015,Incoming,8,2024-09-07 14:10:10,Thank best order whether not.
M0068,30,S006,Outgoing,45,2024-02-01 12:37:55,Know network tree after.
M0069,60,S006,Incoming,76,2024-06-18 03:13:46,Modern indeed compare site business quickly.
M0070,86,S001,Outgoing,75,2024-07-24 07:22:42,Consider idea idea serve activity.
M0071,63,S002,Outgoing,54,2024-05-14 07:22:21,Building thing store relationship power.
M0072,31,S006,Incoming,12,2024-01-11 07:15:51,Effort fight price leave.
M0073,1,S006,Outgoing,83,2024-10-27 23:54:51,Term challenge identify first large.
M0074,18,S014,Outgoing,10,2024-06-16 07:20:42,School even guess trip across nice.
M0075,87,S012,Outgoing,66,2024-08-16 14:49:23,Usually whole life feel.
M0076,23,S008,Outgoing,57,2024-11-15 01:58:54,Challenge memory sea store hope avoid.
M0077,23,S005,Outgoing,95,2024-10-15 16:14:28,Keep different position.
M0078,41,S006,Outgoing,5,2024-02-29 00:06:41,Hour structure score.
M0079,24,S004,Outgoing,8,2024-09-11 12:36:57,Guess defense though follow blood author.
M0080,13,S013,Outgoing,1,2024-08-01 08:44:56,Executive tree option popular action job.
M0081,8,S016,Outgoing,74,2024-07-11 11:52:45,Production around main.
M0082,63,S019,Incoming,17,2024-01-01 03:05:34,Know left go after.
M0083,44,S014,Outgoing,37,2024-06-22 23:42:43,Seat magazine think none administration well.
M0084,15,,Incoming,72,2024-04-23 23:10:36,Couple young sit sign amount.
M0085,65,S020,Incoming,52,2024-05-11 17:01:50,View lay we paper green.
M0086,11,S012,Outgoing,22,2024-01-10 10:10:42,Night skin throw.
M0087,54,S009,Outgoing,71,2024-06-21 12:03:06,You green arm garden good alone.
M0088,25,S016,Incoming,6,2024-09-24 03:50:33,Language situation class today identify.
M0089,54,S012,Outgoing,81,2024-08-17 10:37:40,Understand development realize if.
M0090,33,S004,Outgoing,58,2024-09-16 20:28:33,Issue affect military.
M0091,94,S016,Incoming,26,2024-10-29 22:11:14,Republican stage yet American often spring.
M0092,22,S017,Incoming,26,2024-01-16 04:27:57,Until morning American election front star.
M0093,91,S013,Outgoing,19,2024-03-14 02:30:23,Training long recent give that.
M0094,10,S009,Outgoing,33,2024-07-28 22:13:28,Own there law like eat.
M0095,62,S001,Incoming,68,2024-11-12 14:39:56,Detail bill purpose treat manager how.
M0096,41,S004,Incoming,35,2024-04-10 23:19:45,Fund common recognize.
M0097,13,S008,Incoming,52,2024-10-16 11:53:52,Necessary better style.
M0098,37,S019,Outgoing,51,2024-02-25 04:40:36,Animal seven group stuff husband.
M0099,25,S006,Outgoing,75,2024-01-04 02:44:25,Conference again eight.
M0100,80,S010,Outgoing,42,2024-08-23 00:57:13,Send sport exactly foreign.
M0101,75,S004,Outgoing,51,2024-08-17 01:42:45,A order nature deal least girl.
M0102,34,S012,Outgoing,23,2024-05-23 23:22:30,Space sound wait everyone.
M0103,12,S004,Incoming,7,2024-01-22 22:41:40,Old sound significant particularly.
M0104,43,S001,Incoming,80,2024-06-04 10:56:19,Product away western discussion force.
M0105,20,S010,Outgoing,25,2024-09-13 15:19:23,Mean record just to kind.
M0106,62,S019,Incoming,4,2024-08-06 21:50:52,Music will fire.
M0107,47,S004,Incoming,33,2024-08-18 21:49:11,Realize most important age item.
M0108,55,S018,Outgoing,21,2024-05-04 15:00:17,Shoulder understand action film more.
M0109,53,S009,Incoming,77,2024-09-09 18:52:01,Relate data tonight continue democratic.
M0110,79,S010,Incoming,44,2024-05-03 10:03:19,Drive Democrat away term.
M0111,39,S001,Incoming,34,2024-08-15 19:14:18,Network visit agree career answer white.
M0112,14,S001,Outgoing,89,2024-09-18 00:23:06,Sort realize detail top none.
M0113,77,S005,Outgoing,99,2024-11-07 18:52:01,Camera series family indicate.
M0114,25,S018,Incoming,82,2024-06-25 18:54:58,Friend your type enough.
M0115,12,S019,Outgoing,99,2024-10-30 00:02:40,Give very a put cost.
M0116,54,S018,Incoming,3,2024-08-22 23:24:17,Decade modern purpose.
M0117,98,S007,Outgoing,23,2024-01-31 13:19:27,Those interest air carry.
M0118,63,S016,Incoming,11,2024-10-16 11:35:22,Send above partner.
M0119,76,S008,Incoming,87,2024-02-02 13:17:33,Statement bar half.
M0120,46,S013,Incoming,13,2024-03-13 11:32:34,Push least city raise phone easy.
M0121,93,S001,Incoming,100,2024-02-09 10:44:48,Admit red building cup eat hard.
M0122,61,S002,Outgoing,89,2024-07-08 11:33:44,Response lay name.
M0123,2,S016,Incoming,11,2024-09-22 05:01:27,High maybe nearly continue worker you.
M0124,39,S017,Outgoing,27,2024-06-10 16:33:27,Stay when say which table.
M0125,29,S006,Outgoing,25,2024-09-17 07:32:01,Set provide theory even.
M0126,45,S018,Incoming,14,2024-07-31 12:43:19,Dinner compare charge.
M0127,98,S013,Incoming,86,2024-08-28 17:40:01,Do data thank.
M0128,51,S006,Incoming,88,2024-08-11 17:13:00,Second number quality change.
M0129,6,S012,Outgoing,5,2024-11-06 12:35:56,Attorney learn whom case than less.
M0130,78,S014,Incoming,71,2024-01-05 09:17:19,Local short miss citizen Democrat try.
M0131,89,S003,Incoming,93,2024-08-17 03:52:37,Stop common sea gas.
M0132,67,S018,Incoming,57,2024-06-03 15:12:20,Them real major.
M0133,19,S009,Outgoing,95,2024-04-05 19:23:42,Open fish law participant early walk.
M0134,49,S003,Incoming,58,2024-02-16 17:54:59,Appear wrong media soldier over and.
M0135,99,S009,Incoming,89,2024-03-07 13:29:58,Strategy moment notice.
M0136,14,S015,Outgoing,36,2024-01-04 17:45:26,Theory game put my last assume.
M0137,4,S003,Outgoing,4,2024-03-30 08:35:24,Contain quite heart.
M0138,27,S015,Incoming,14,2024-10-16 21:03:08,Require agreement voice.
M0139,100,S016,Outgoing,71,2024-09-04 17:26:17,Recent foot argue.
M0140,97,S014,Outgoing,22,2024-06-28 03:30:37,All analysis sense theory fine.
M0141,73,S017,Incoming,3,2024-10-07 16:09:37,Actually serve benefit represent could.
M0142,49,S020,Incoming,11,2024-07-19 18:40:35,Yeah focus defense majority say.
M0143,30,S018,Outgoing,91,2024-08-05 10:07:45,Soldier high audience mission stop.
M0144,64,S008,Outgoing,32,2024-03-27 06:20:01,Act police education those concern arm.
M0145,16,S009,Incoming,94,2024-07-27 19:45:50,Growth example maybe improve.
M0146,78,S020,Incoming,86,2024-08-21 06:49:03,Sing two suggest report add address.
M0147,87,S009,Outgoing,37,2024-02-27 00:43:08,Inside since memory father.
M0148,17,S009,Incoming,37,2024-05-24 12:23:04,Say produce now pressure term next.
M0149,74,S002,Incoming,2,2024-03-22 01:30:11,Interview sure among.
M0150,57,S019,Outgoing,72,2024-08-31 21:54:39,Car majority see thing.
M0151,31,S011,Incoming,74,2024-06-26 08:03:51,Such agent explain.
M0152,35,S007,Incoming,43,2024-11-11 02:21:36,Authority specific find.
M0153,96,S005,Incoming,9,2024-02-29 23:36:45,Public bank industry by everyone.
M0154,24,S013,Outgoing,12,2024-10-27 05:27:29,Political when attack say personal.
M0155,87,S018,Outgoing,72,2024-10-31 23:24:20,Baby language law.
M0156,72,S003,Incoming,83,2024-01-24 06:14:55,Hour woman professor student.
M0157,91,S010,Outgoing,18,2024-09-05 03:13:19,Daughter look southern case.
M0158,49,S012,Incoming,1,2024-06-22 20:47:47,Team make though speech herself evidence.
M0159,14,S019,Incoming,46,2024-06-19 09:24:23,Among floor somebody trip put.
M0160,2,S003,Incoming,23,2024-04-27 23:03:13,Skin main vote particular.
M0161,4,S014,Incoming,4,2024-11-16 07:56:08,Team early side group budget.
M0162,52,S010,Outgoing,42,2024-05-31 00:04:12,Better son house.
M0163,75,S001,Outgoing,65,2024-08-27 19:00:14,Or forward fill.
M0164,79,S013,Outgoing,7,2024-04-09 04:34:31,Enter choice coach trial rich ahead.
M0165,97,S016,Outgoing,17,2024-04-01 12:07:56,Four rock call own international.
M0166,12,S015,Outgoing,21,2024-03-03 19:57:33,Center become campaign.
M0167,15,S011,Outgoing,32,2024-04-28 16:10:18,Heart Mrs hospital girl range professor.
M0168,71,S020,Outgoing,49,2024-07-08 12:25:18,Establish understand quite particular actually crime.
M0169,48,S019,Outgoing,52,2024-09-12 10:54:15,Argue expert early scientist.
M0170,14,S015,Incoming,72,2024-09-12 09:58:26,Political material open.
M0171,78,S002,Incoming,49,2024-11-10 08:26:33,Reason significant shoulder identify religious.
M0172,87,S010,Incoming,23,2024-07-06 07:03:03,Without energy field.
M0173,42,S007,Incoming,26,2024-11-03 12:38:27,Same mother pick hospital.
M0174,40,S012,Incoming,44,2024-08-30 23:42:04,Too increase cell thousand.
M0175,52,S018,Outgoing,98,2024-08-29 15:27:00,Her general crime how.
M0176,13,S003,Outgoing,23,2024-05-20 15:00:07,Common mission class enjoy.
M0177,89,S004,Outgoing,39,2024-04-20 19:52:47,Car fear since particularly himself trip.
M0178,81,S001,Outgoing,26,2024-06-14 03:18:49,Hope manager real.
M0179,63,S014,Outgoing,3,2024-08-22 20:23:36,Point break themselves.
M0180,59,S007,Outgoing,97,2024-02-20 15:22:42,Later yeah design force until.
M0181,41,S012,Incoming,97,2024-03-22 17:23:55,Strategy sense model matter set natural.
M0182,8,S003,Outgoing,99,2024-05-17 15:41:16,Above shoulder consider film PM each.
M0183,42,S005,Incoming,35,2024-09-20 16:17:21,Adult about name court fall want.
M0184,10,S015,Outgoing,27,2024-07-08 05:08:06,Prove many note practice difference.
M0185,5,S002,Outgoing,66,2024-03-05 12:32:28,Mrs still on building worker.
M0186,70,S010,Outgoing,99,2024-04-02 16:12:14,All kitchen physical in.
M0187,95,S001,Outgoing,42,2024-01-11 20:49:09,Impact drive whose compare customer.
M0188,58,S016,Incoming,20,2024-03-23 22:22:10,Cold party foot travel us score.
M0189,28,S001,Outgoing,50,2024-04-27 23:00:56,Carry opportunity bring.
M0190,8,S012,Outgoing,43,2024-05-09 04:28:29,Like detail fight wind room much.
M0191,95,S007,Incoming,53,2024-10-31 12:18:03,Baby good task approach.
M0192,84,S010,Incoming,2,2024-10-29 01:51:50,Clearly fight partner former because.
M0193,28,S012,Outgoing,81,2024-04-07 11:49:43,Too activity join summer play.
M0194,74,S006,Incoming,13,2024-04-04 10:05:47,Central threat which.
M0195,59,S019,Outgoing,49,2024-01-20 08:34:05,Because quality ball line.
M0196,48,S007,Incoming,57,2024-02-06 06:37:43,Choice we require.
M0197,31,S009,Outgoing,64,2024-06-04 23:27:23,Tough perform fill trouble.
M0198,21,S018,Outgoing,79,2024-09-11 20:27:48,Make property range commercial.
M0199,80,S012,Incoming,89,2024-08-23 11:19:41,Wonder after couple especially perform.
M0200,4,S002,Outgoing,43,2024-03-03 11:09:35,Bad age score according decide.
M0201,2,S002,Incoming,91,2024-01-09 21:53:59,Speech training south far.
M0202,10,S011,Incoming,3,2024-11-09 06:52:42,Until glass much manage cold final.
M0203,46,S006,Outgoing,94,2024-10-15 16:42:36,Not kind federal require trip employee.
M0204,17,S019,Incoming,39,2024-05-27 17:47:48,South myself Mrs record citizen get.
M0205,24,S004,Incoming,48,2024-09-25 07:01:12,Social receive notice half idea.
M0206,52,S014,Incoming,45,2024-09-09 22:09:52,Hotel law accept among.
M0207,4,S017,Incoming,11,2024-04-10 23:38:10,Need begin laugh yeah hair east.
M0208,33,S010,Outgoing,25,2024-07-03 11:32:37,All source listen.
M0209,50,S010,Outgoing,99,2024-09-23 08:03:05,Ahead create window lay sit.
M0210,50,S002,Incoming,18,2024-09-14 04:25:31,Firm must walk.
M0211,81,S002,Incoming,83,2024-01-28 19:40:51,Throughout population cell.
M0212,51,S008,Outgoing,54,2024-08-04 13:35:08,Girl quite nearly success.
M0213,75,S011,Outgoing,9,2024-01-02 07:20:05,Finally term popular.
M0214,70,S020,Incoming,10,2024-11-12 01:06:38,Road we remember pressure study.
M0215,96,S016,Outgoing,27,2024-06-25 11:48:50,Mention know group.
M0216,86,S006,Incoming,6,2024-04-15 09:32:14,Stand American available not.
M0217,47,S011,Outgoing,34,2024-10-02 08:36:28,Test fund mean front affect.
M0218,19,S006,Incoming,93,2024-07-23 05:40:15,Arrive finish piece ok consider.
M0219,75,S004,Outgoing,33,2024-09-03 06:33:45,However me hard financial.
M0220,80,S013,Outgoing,95,2024-04-12 07:56:19,Recently again defense office.
M0221,42,S004,Incoming,60,2024-10-31 12:06:31,Which ahead strategy machine east they.
M0222,9,S004,Incoming,63,2024-04-15 19:06:58,Stock authority gas.
M0223,32,S014,Outgoing,94,2024-07-01 18:23:32,Them many discussion occur.
M0224,65,S010,Incoming,11,2024-05-26 13:30:08,They material middle friend later.
M0225,63,S011,Outgoing,63,2024-03-24 21:51:39,Despite forward some unit.
M0226,38,S018,Incoming,32,2024-05-08 03:31:22,Best million provide me strong break.
M0227,45,S017,Incoming,7,2024-03-08 06:02:48,Vote coach success history.
M0228,63,S018,Outgoing,45,2024-05-12 13:33:18,Allow account if both.
M0229,96,S008,Outgoing,70,2024-06-04 17:11:32,School page lawyer.
M0230,9,S020,Incoming,28,2024-11-15 21:11:16,Ground lot leave.
M0231,48,S003,Outgoing,25,2024-04-22 17:31:52,Behavior can fight fact chair.
M0232,71,S010,Outgoing,47,2024-10-12 12:45:52,Yourself green difficult foot dinner tax garden.
M0233,22,S005,Outgoing,46,2024-08-09 07:04:44,Remember customer dog.
M0234,53,S010,Outgoing,2,2024-02-18 14:00:06,Person word serious special work.
M0235,51,S010,Incoming,1,2024-06-12 09:19:40,Offer respond play risk mother.
M0236,96,S020,Incoming,62,2024-04-04 06:27:46,Congress government catch experience.
M0237,23,S007,Incoming,1,2024-10-22 07:36:15,Need score look affect almost force.
M0238,31,S008,Outgoing,66,2024-07-27 02:04:14,Capital thank black.
M0239,99,S008,Incoming,96,2024-10-02 00:21:04,Structure light hope whatever southern travel.
M0240,98,S020,Outgoing,6,2024-07-05 19:02:09,Wonder huge green dinner democratic.
M0241,52,S013,Incoming,72,2024-06-03 14:44:31,It surface various talk movie model.
M0242,80,S004,Incoming,37,2024-07-27 01:53:51,Attention its deep.
M0243,31,S013,Incoming,57,2024-01-20 06:38:35,Save executive treatment law use.
M0244,60,S016,Outgoing,81,2024-01-05 10:54:56,Bill arrive knowledge record nation.
M0245,41,S016,Incoming,71,2024-01-19 03:20:35,North fly check sure firm.
M0246,26,S016,Incoming,3,2024-09-11 21:41:24,Throw away tonight.
M0247,21,S013,Incoming,32,2024-10-13 19:41:34,Customer street pressure owner.
M0248,56,S005,Outgoing,76,2024-08-25 22:40:09,War establish cup figure.
M0249,62,S004,Outgoing,39,2024-10-30 13:34:58,Practice identify bar.
M0250,16,S007,Incoming,23,2024-02-20 23:45:48,Address late buy push.
M0251,94,S009,Outgoing,48,2024-10-03 03:36:18,Physical any yourself.
M0252,31,S009,Incoming,30,2024-04-29 20:01:53,Peace read economic.
M0253,64,S014,Outgoing,81,2024-03-28 06:27:35,Husband after exactly wish second indicate.
M0254,15,S019,Outgoing,99,2024-07-26 21:04:00,Simply ever debate thought story finally.
M0255,90,S013,Outgoing,53,2024-09-26 21:17:14,Field relationship trade know figure big.
M0256,17,S011,Incoming,48,2024-09-30 07:42:18,Particularly town why parent close.
M0257,43,S013,Incoming,52,2024-08-09 15:13:27,Seven off manager speak even radio.
M0258,52,S013,Outgoing,87,2024-09-07 17:01:21,Real tax your sign.
M0259,97,S014,Incoming,67,2024-04-20 00:28:40,Lead onto attention benefit.
M0260,6,S012,Outgoing,95,2024-05-16 07:27:42,Our middle song write.
M0261,13,S008,Incoming,33,2024-09-16 00:33:32,Ten citizen arrive that history.
M0262,32,S011,Incoming,50,2024-08-21 11:52:38,Institution hair religious.
M0263,46,S019,Outgoing,75,2024-08-28 01:43:32,Inside deep local information.
M0264,26,S006,Incoming,82,2024-05-12 04:34:03,Still night successful prepare statement mouth.
M0265,64,S014,Incoming,57,2024-02-29 18:46:07,Care magazine TV.
M0266,75,S010,Incoming,55,2024-01-26 16:42:56,Head foreign half anyone.
M0267,45,S014,Outgoing,50,2024-07-16 04:34:57,Shake another thus party husband will.
M0268,73,S012,Outgoing,81,2024-07-04 01:49:27,Always the example consumer.
M0269,66,S005,Outgoing,74,2024-06-07 20:56:39,Language Democrat home.
M0270,24,S010,Outgoing,71,2024-05-07 15:35:18,Big ten hundred.
M0271,98,S001,Outgoing,63,2024-06-10 09:11:03,Water rule investment.
M0272,77,S001,Incoming,56,2024-11-20 18:52:28,Almost Democrat kitchen.
M0273,22,S001,Outgoing,88,2024-07-10 00:29:57,Against full allow.
M0274,31,S004,Outgoing,2,2024-02-01 06:23:55,Difference drive finish present guess page.
M0275,80,S005,Outgoing,35,2024-03-06 12:30:17,Address seek pick sound daughter.
M0276,17,S002,Outgoing,26,2024-11-19 16:26:26,System course article minute theory.
M0277,44,S020,Outgoing,13,2024-07-11 10:21:41,Eat direction maybe appear staff camera.
M0278,51,S020,Outgoing,27,2024-05-05 03:52:06,Car popular generation.
M0279,80,S019,Incoming,9,2024-02-25 17:14:25,Responsibility traditional week be matter.
M0280,25,S002,Incoming,40,2024-11-19 07:56:06,Various Congress choice majority.
M0281,32,S005,Incoming,29,2024-05-25 20:13:24,Where then to assume commercial.
M0282,42,S010,Incoming,16,2024-04-21 02:37:35,Simple sit gun son support stay.
M0283,40,S004,Outgoing,48,2024-04-30 09:43:34,Billion base line political grow.
M0284,82,S016,Outgoing,87,2024-07-30 06:55:17,Ago any quality.
M0285,66,S015,Outgoing,35,2024-03-30 04:15:53,Anyone yeah training food.
M0286,14,S004,Incoming,1,2024-06-06 15:59:22,Ten and pretty.
M0287,20,S020,Outgoing,74,2024-02-11 01:26:53,Low ten argue professional.
M0288,58,S018,Outgoing,38,2024-11-18 12:44:43,Close check though care late.
M0289,26,S020,Incoming,73,2024-01-30 03:51:48,Study protect bill suggest food treat.
M0290,52,S002,Outgoing,4,2024-02-26 10:59:17,New raise opportunity.
M0291,87,S008,Incoming,54,2024-09-21 10:53:33,Director stay market several energy marriage.
M0292,68,S017,Outgoing,75,2024-02-07 07:31:15,Mention sure leave apply produce.
M0293,59,S014,Outgoing,21,2024-10-20 13:53:55,Point and lay.
M0294,34,S020,Incoming,54,2024-02-03 09:02:02,Whole player late front.
M0295,50,S002,Outgoing,47,2024-03-08 18:12:41,Read away behavior control watch at.
M0296,36,S011,Incoming,2,2024-05-12 15:18:41,Artist parent product win.
M0297,39,S006,Outgoing,77,2024-05-27 10:34:44,See movement finish difficult.
M0298,2,S016,Incoming,92,2024-07-29 23:19:36,Even through fund hit Mrs child.
M0299,80,S014,Outgoing,71,2024-01-29 05:18:45,Sell section defense red exactly.
M0300,53,S007,Outgoing,75,2024-01-11 00:25:11,Across maintain civil.
M0301,45,S010,Incoming,20,2024-05-30 11:33:17,White learn poor executive set gun.
M0302,11,S007,Incoming,88,2024-04-01 03:05:56,Because production learn many enough.
M0303,52,S009,Outgoing,52,2024-02-10 19:18:54,Imagine thank war wait.
M0304,45,S002,Incoming,24,2024-05-22 23:59:02,Quickly bank surface establish business.
M0305,67,S013,Outgoing,57,2024-07-26 20:06:38,Door seek writer.
M0306,60,S003,Outgoing,63,2024-04-04 03:26:47,Source way wish account story.
M0307,29,S014,Outgoing,56,2024-05-11 10:45:11,Science remain heart affect.
M0308,12,S006,Outgoing,47,2024-08-16 02:55:40,Like age travel everyone return last.
M0309,35,S017,Incoming,63,2024-08-27 01:42:35,Wish traditional offer note trial.
M0310,34,S005,Incoming,88,2024-04-11 02:47:57,Watch wrong produce begin final.
M0311,17,S001,Incoming,71,2024-03-30 21:44:48,Believe low north.
M0312,58,S014,Outgoing,99,2024-02-26 12:53:08,Surface ahead democratic.
M0313,84,S017,Incoming,59,2024-09-08 18:25:34,Low system minute argue central.
M0314,79,S015,Outgoing,9,2024-03-11 23:52:12,Discussion quite fund.
M0315,72,S014,Outgoing,43,2024-06-22 01:21:19,Hotel food exist.
M0316,60,S003,Outgoing,91,2024-10-24 06:44:55,Value tough piece.
M0317,49,S003,Outgoing,15,2024-08-09 09:16:04,Ago more then history recognize prove.
M0318,39,S015,Outgoing,41,2024-04-03 02:58:28,Mission new site treatment when space.
M0319,65,S016,Incoming,86,2024-08-28 23:07:59,Point couple customer better senior about.
M0320,43,S017,Incoming,74,2024-05-05 21:51:49,Raise too before nearly food appear.
M0321,59,S016,Incoming,45,2024-02-23 08:14:07,Save project bill.
M0322,78,S004,Outgoing,77,2024-03-30 18:55:15,Young probably avoid crime ten.
M0323,34,S012,Incoming,18,2024-01-25 12:19:12,Specific prevent similar defense nice little.
M0324,33,S020,Outgoing,65,2024-01-27 20:34:56,Seek weight class.
M0325,11,S010,Outgoing,41,2024-10-07 13:18:55,Add vote everyone.
M0326,65,S015,Outgoing,19,2024-03-28 16:28:44,Smile wrong forget animal thus word.
M0327,99,S008,Incoming,9,2024-02-07 21:16:52,Action company use him.
M0328,26,S014,Incoming,100,2024-11-08 16:42:22,Know relationship whose movie shoulder.
M0329,44,S016,Incoming,7,2024-07-23 18:52:30,Just his push lead.
M0330,41,S005,Incoming,95,2024-03-01 19:52:06,Remain begin house.
M0331,8,S015,Outgoing,9,2024-09-17 15:21:48,Idea strategy race.
M0332,35,S011,Incoming,37,2024-05-01 17:58:38,Word happy message.
M0333,20,S015,Incoming,7,2024-10-04 04:29:13,Either them daughter crime people.
M0334,21,S018,Outgoing,79,2024-10-16 22:49:07,Young see process.
M0335,67,S003,Outgoing,54,2024-03-12 22:17:00,Range listen health.
M0336,1,S004,Outgoing,95,2024-03-30 19:54:35,Might other serious.
M0337,54,S020,Outgoing,17,2024-01-30 05:43:14,Treat safe dog if room fight.
M0338,97,S007,Outgoing,96,2024-02-02 15:15:04,Significant modern news crime season.
M0339,35,S007,Outgoing,85,2024-09-09 11:02:50,Himself let force bar very total.
M0340,8,S011,Outgoing,98,2024-05-25 23:47:31,Drive trip you.
M0341,84,S004,Incoming,31,2024-03-11 09:44:12,Suddenly buy fire eat pattern.
