MovementID,ItemID,SupplierID,MovementType,Quantity,MovementDate,Remarks
M0342,90,S017,Incoming,16,2024-01-13 21:56:49,Difference walk bad investment.
M0343,68,S005,Outgoing,11,2024-08-21 00:49:24,Tax behind concern believe so.
M0344,45,S003,Outgoing,62,2024-06-11 19:09:12,Eight share husband challenge.
M0345,3,S001,Incoming,33,2024-03-17 20:37:42,Music north quality.
M0346,22,S008,Incoming,89,2024-04-03 17:42:44,Quite way owner city teacher training.
M0347,93,S005,Incoming,69,2024-01-14 16:09:03,Seat help education call assume.
M0348,74,S005,Outgoing,93,2024-06-15 15:59:01,Wrong success executive thing what image.
M0349,22,S011,Outgoing,9,2024-11-10 06:59:13,Same both positive.
M0350,69,S009,Outgoing,76,2024-01-09 20:06:31,Lay foreign window Congress now break.
M0351,32,S006,Incoming,18,2024-03-08 17:23:13,Beyond impact soldier.
M0352,32,S002,Outgoing,64,2024-01-18 13:05:58,Last hundred can cultural person.
M0353,27,S014,Outgoing,30,2024-08-12 12:09:56,Coach conference southern.
M0354,53,S008,Incoming,48,2024-02-09 00:03:16,Father remain section month consider.
M0355,83,S020,Outgoing,50,2024-01-06 05:44:11,Out friend member.
M0356,88,S019,Incoming,7,2024-04-15 19:25:46,Run at soon toward.
M0357,40,S020,Incoming,20,2024-01-28 06:28:43,Beautiful recognize require career business.
M0358,86,S012,Outgoing,10,2024-01-23 23:28:32,Drop remain stop piece goal main.
M0359,19,S005,Incoming,2,2024-09-03 08:25:57,Next although law.
M0360,86,S007,Outgoing,14,2024-10-10 00:50:49,Age wonder mission base.
M0361,55,S017,Incoming,65,2024-01-21 02:04:29,Appear night save everyone.
M0362,21,S016,Incoming,71,2024-07-12 10:04:59,Great let where.
M0363,47,S008,Outgoing,51,2024-08-30 10:29:15,Give sure worker identify.
M0364,21,S015,Incoming,66,2024-08-06 12:20:34,Move Mrs front million always young.
M0365,38,S001,Outgoing,56,2024-04-12 09:33:40,Prepare next test fish today.
M0366,92,S019,Outgoing,28,2024-05-28 14:19:00,President remember cut thousand choose increase.
M0367,92,S008,Outgoing,54,2024-09-16 23:01:44,Paper case surface.
M0368,57,S014,Outgoing,84,2024-09-29 14:48:17,From goal stop father.
M0369,12,S013,Incoming,59,2024-01-22 12:24:44,Sing sit brother majority may.
M0370,38,S007,Outgoing,97,2024-09-03 03:44:13,Tv close around ten concern for.
M0371,85,S003,Outgoing,91,2024-08-26 07:36:14,Policy economic simple economy.
M0372,80,S018,Outgoing,49,2024-04-14 20:59:11,Its evening sense.
M0373,69,S002,Outgoing,37,2024-02-04 02:01:41,Kid machine who get job start.
M0374,1,S003,Incoming,87,2024-07-16 19:11:33,Chair power commercial.
M0375,24,S005,Incoming,26,2024-02-08 14:03:30,Strong without human instead.
M0376,82,S018,Outgoing,66,2024-09-18 02:59:39,Wait happy set might.
M0377,89,S014,Outgoing,37,2024-09-24 17:51:33,Stage recognize left.
M0378,40,S018,Incoming,28,2024-02-02 09:05:53,Class big guy mention task lot.
M0379,40,S014,Outgoing,99,2024-07-21 11:07:35,Road already first spend glass very.
M0380,15,S014,Incoming,66,2024-01-16 22:40:30,Music heavy knowledge.
M0381,54,S001,Incoming,59,2024-01-14 12:04:32,Million peace accept amount his then.
M0382,26,S011,Outgoing,50,2024-01-09 14:08:24,Until not young face.
M0383,89,S015,Incoming,61,2024-05-12 00:59:40,Security difficult must strong may.
M0384,86,S016,Outgoing,75,2024-10-07 23:16:40,Themselves couple world system herself politics.
M0385,65,S011,Outgoing,62,2024-07-13 22:58:17,Never until door member.
M0386,45,S015,Incoming,91,2024-07-20 22:24:07,Ground star newspaper road heavy.
M0387,3,S005,Incoming,42,2024-04-05 21:18:23,Man son use by.
M0388,90,S003,Outgoing,15,2024-01-21 23:17:00,Generation trip week.
M0389,37,S008,Incoming,50,2024-03-08 07:57:05,Daughter traditional month.
M0390,22,S008,Incoming,44,2024-09-28 22:31:36,Do ability majority item challenge attention.
M0391,75,S020,Outgoing,18,2024-11-07 09:35:49,Whatever peace big evidence.
M0392,92,S013,Incoming,74,2024-09-24 10:33:19,Environment painting natural site along.
M0393,35,S001,Outgoing,4,2024-03-03 10:00:26,Research produce expect rule benefit break.
M0394,79,S003,Outgoing,58,2024-06-23 12:49:02,Cover common man part easy head.
M0395,43,S011,Outgoing,49,2024-10-09 00:02:50,Player can that.
M0396,33,S016,Incoming,45,2024-04-04 17:29:27,Stop population real player central.
M0397,62,S009,Incoming,93,2024-08-26 08:06:21,Energy impact artist upon sister.
M0398,45,S020,Outgoing,91,2024-03-20 17:16:02,True table stay.
M0399,37,S019,Incoming,94,2024-11-18 08:30:30,This of eat onto fall.
M0400,67,S001,Incoming,42,2024-03-24 14:03:27,Class kind table break and small.
M0401,44,S015,Incoming,35,2024-10-06 20:50:19,Well save each oil family special.
M0402,64,S015,Incoming,95,2024-09-11 12:59:15,Glass along inside bank.
M0403,70,S006,Incoming,6,2024-04-29 19:52:44,Become section say news perhaps.
M0404,81,S010,Incoming,82,2024-04-14 06:39:17,Understand true specific manage political.
M0405,78,S018,Outgoing,12,2024-11-04 22:38:50,International picture idea.
M0406,14,S018,Outgoing,82,2024-05-24 21:35:22,Back player help history machine.
M0407,81,S019,Incoming,14,2024-10-12 12:23:19,Play one investment.
M0408,6,S002,Incoming,18,2024-06-21 00:51:15,Be difficult admit tax mind wide.
M0409,81,S001,Incoming,68,2024-05-22 22:21:52,Mr even technology medical forget.
M0410,40,S004,Outgoing,8,2024-09-14 20:51:20,Benefit manager summer happen want entire.
M0411,29,S001,Incoming,48,2024-07-14 00:04:40,Relationship real tell no information.
M0412,84,S010,Outgoing,43,2024-05-21 08:39:18,Establish party ok particularly official rest.
M0413,14,S015,Outgoing,7,2024-01-10 14:43:51,Song need surface involve ability.
M0414,55,S005,Incoming,7,2024-08-13 01:11:55,Hot turn sound all.
M0415,68,S020,Outgoing,72,2024-03-11 16:35:31,Professional current response job mouth entire.
M0416,68,S001,Outgoing,47,2024-06-05 10:34:06,Hold drug good will really.
M0417,26,S001,Incoming,18,2024-07-15 21:14:27,Believe more let clear.
M0418,89,S013,Outgoing,49,2024-05-11 06:40:25,Then process perhaps foreign beautiful.
M0419,95,S016,Outgoing,24,2024-07-17 17:45:23,For wish likely with.
M0420,74,S019,Incoming,39,2024-03-12 13:04:46,Mind role hundred evidence.
M0421,96,S013,Incoming,20,2024-05-13 23:40:32,Admit front you real customer six.
M0422,52,S003,Incoming,30,2024-02-23 01:08:57,Without tend learn staff.
M0423,88,S011,Incoming,26,2024-03-11 22:27:43,Great stop consider standard think month.
M0424,83,S001,Incoming,80,2024-01-16 01:57:03,Single approach last.
M0425,89,S014,Outgoing,63,2024-11-13 17:02:47,Usually prove thing.
M0426,62,S012,Incoming,33,2024-04-25 08:22:53,Worry speech also.
M0427,78,S017,Incoming,28,2024-10-03 01:26:46,Service audience other again some.
M0428,68,S004,Incoming,73,2024-02-08 21:47:07,Sound building discover.
M0429,20,S004,Outgoing,89,2024-07-22 06:39:50,Discussion where group within hit.
M0430,13,S001,Incoming,38,2024-08-26 11:21:19,Often north amount.
M0431,17,S001,Incoming,9,2024-09-09 15:44:00,Morning decade wait own.
M0432,59,S020,Incoming,22,2024-08-14 16:11:11,Federal item ever.
M0433,46,S015,Outgoing,47,2024-07-16 20:59:11,Picture anything much fire.
M0434,21,S009,Incoming,76,2024-11-10 08:16:50,Behind control health exist world information.
M0435,5,S004,Outgoing,74,2024-03-21 02:16:42,Assume police analysis or soon yourself.
M0436,87,S013,Incoming,3,2024-09-20 18:07:45,Fund adult indeed for central future.
M0437,12,S014,Incoming,58,2024-03-31 21:31:58,Require various himself young throughout.
M0438,31,S019,Outgoing,93,2024-10-06 18:03:33,Interest popular magazine nothing.
M0439,74,S016,Outgoing,53,2024-03-20 22:34:46,Describe family daughter.
M0440,56,S007,Incoming,72,2024-11-07 18:52:38,Risk color design practice available.
M0441,80,S018,Outgoing,11,2024-07-16 11:09:55,Age voice speak tonight issue least.
M0442,31,S005,Outgoing,66,2024-11-10 03:25:23,Unit kid put impact pressure close.
M0443,66,S005,Outgoing,65,2024-03-09 11:07:45,Into network left law view.
M0444,96,S017,Incoming,97,2024-05-17 04:16:16,Somebody dream money citizen.
M0445,37,S013,Incoming,98,2024-05-29 08:24:39,Pm cold nature.
M0446,32,S016,Outgoing,34,2024-03-02 03:31:37,Return reality sister.
M0447,79,S010,Incoming,38,2024-07-01 05:18:42,Bed head service development.
M0448,56,S017,Outgoing,93,2024-08-22 20:09:19,Contain accept project unit experience.
M0449,96,S004,Outgoing,53,2024-09-22 04:42:24,Save single fine brother reason.
M0450,69,S013,Incoming,76,2024-01-07 06:02:55,Model drug administration.
M0451,26,S010,Incoming,79,2024-09-06 00:24:59,Be choose itself leg issue.
M0452,84,S016,Incoming,30,2024-10-24 03:54:52,Paper explain seem painting director Mrs.
M0453,28,S012,Outgoing,27,2024-02-11 20:57:40,Early life serve around.
M0454,25,S003,Outgoing,77,2024-02-21 08:20:41,War fine hard notice.
M0455,32,S012,Outgoing,2,2024-08-23 08:06:27,Mrs among difficult.
M0456,39,S007,Incoming,94,2024-08-31 18:14:14,Hair nation politics than.
M0457,53,S016,Incoming,100,2024-03-22 06:37:01,These rest person blue describe green.
M0458,6,S010,Incoming,20,2024-04-28 20:17:20,Great player arrive PM.
M0459,64,S019,Outgoing,88,2024-01-07 22:48:56,Rest up turn suggest piece.
M0460,75,S010,Incoming,8,2024-04-29 06:52:50,Total face work agency left usually.
M0461,82,S011,Outgoing,33,2024-06-20 11:09:07,Now radio arm real.
M0462,13,S014,Outgoing,66,2024-02-01 08:55:12,Tv since culture painting.
M0463,67,S009,Incoming,31,2024-08-24 09:48:53,Clear list probably either president.
M0464,71,S020,Outgoing,2,2024-07-06 19:54:01,Mention maintain trade.
M0465,76,S008,Incoming,16,2024-05-10 22:01:19,Natural simple community growth.
M0466,38,S016,Incoming,22,2024-11-09 11:16:20,Represent mother four herself.
M0467,100,S003,Outgoing,83,2024-01-12 21:04:25,Others describe anyone answer.
M0468,52,S018,Outgoing,41,2024-08-07 14:53:00,Alone material later economic.
M0469,58,S004,Outgoing,83,2024-05-29 18:24:42,Minute national popular.
M0470,51,S004,Outgoing,67,2024-04-16 02:30:06,Above ever side.
M0471,99,S003,Outgoing,97,2024-08-03 00:03:25,Current talk second.
M0472,90,S009,Outgoing,60,2024-09-10 02:49:56,Enter especially white campaign image.
M0473,76,S020,Incoming,67,2024-11-06 01:32:38,Family son quite human budget.
M0474,40,S019,Outgoing,53,2024-08-11 13:50:39,Account but drive everybody.
M0475,84,S003,Outgoing,62,2024-02-09 14:34:35,Health exactly sport tax matter however.
M0476,85,S001,Outgoing,12,2024-01-19 17:01:41,Big face should.
M0477,66,S016,Outgoing,18,2024-01-27 16:19:42,Job politics black require up child.
M0478,72,S014,Outgoing,85,2024-08-09 03:53:04,Us fall I.
M0479,28,S013,Outgoing,92,2024-05-25 08:07:12,Training perform yourself.
M0480,64,S001,Incoming,84,2024-09-17 10:44:03,Thing avoid born would.
M0481,90,S007,Outgoing,40,2024-11-08 03:39:40,Prevent develop month number development enjoy.
M0482,13,S012,Incoming,82,2024-09-05 06:55:50,Among you south central miss.
M0483,96,S007,Incoming,54,2024-04-17 22:10:50,These require hair meet.
M0484,74,S004,Outgoing,37,2024-11-16 15:00:15,Name raise another professor usually language.
M0485,24,S004,Outgoing,51,2024-11-05 14:53:44,Away black kid last seek.
M0486,74,S005,Outgoing,61,2024-04-02 20:22:27,Attack young hit.
M0487,61,S013,Incoming,12,2024-09-16 12:55:46,Trade rate move ever old country.
M0488,10,S016,Incoming,17,2024-03-01 23:02:17,Hit people learn floor.
M0489,43,S015,Incoming,33,2024-07-10 12:49:17,Agreement middle financial place.
M0490,26,S018,Incoming,8,2024-05-31 15:12:37,Analysis chair close.
M0491,69,S016,Incoming,73,2024-02-10 15:31:36,Clearly look figure traditional hotel.
M0492,19,S012,Outgoing,76,2024-11-02 18:17:53,Cup result fight require stay knowledge.
M0493,56,S014,Incoming,2,2024-05-18 01:41:16,Team rather car instead.
M0494,82,S015,Incoming,18,2024-07-30 00:02:14,Quality her let.
M0495,69,S020,Incoming,22,2024-08-15 16:27:40,Experience science foot.
M0496,4,S003,Outgoing,23,2024-02-04 15:54:16,Travel when position.
M0497,46,S016,Outgoing,38,2024-11-12 22:01:32,Recently maintain goal.
M0498,13,S006,Outgoing,58,2024-06-08 15:24:26,Color participant sure theory quality.
M0499,74,S019,Incoming,38,2024-09-06 18:06:30,Ago information direction last will.
M0500,32,S012,Outgoing,32,2024-04-03 17:43:48,Improve second second keep cold ever.
